{
  "id": "12345678904",
  "type": "issue_comment.created",
  "repository": "octocat/Hello-World",
  "repositoryOwner": "octocat",
  "repositoryName": "Hello-World",
  "actor": "reviewer",
  "createdAt": "2024-01-15T13:00:00Z",
  "issue": {
    "number": 42,
    "title": "Bug: Application crashes on startup",
    "state": "open",
    "labels": ["bug", "high-priority"],
    "author": "octocat",
    "url": "https://github.com/octocat/Hello-World/issues/42"
  },
  "comment": {
    "author": "reviewer",
    "url": "https://github.com/octocat/Hello-World/issues/42#issuecomment-123456",
    "body": "I can reproduce this issue. It happens when the config file is missing."
  }
}
