{
  "id": "12345678903",
  "type": "discussion.created",
  "repository": "octocat/Hello-World",
  "repositoryOwner": "octocat",
  "repositoryName": "Hello-World",
  "actor": "community-member",
  "createdAt": "2024-01-15T12:00:00Z",
  "discussion": {
    "number": 5,
    "title": "How to contribute to this project?",
    "category": "Q&A",
    "author": "community-member",
    "url": "https://github.com/octocat/Hello-World/discussions/5"
  }
}
